{
  "verdict": "PASS",
  "dast_findings": [],
  "sca_cves": [],
  "secrets": 0,
  "new_vs_baseline": {
    "dast": {
      "new": 0,
      "accepted": 0,
      "fixed": 0
    },
    "sca": {
      "new": 0,
      "accepted": 0,
      "fixed": 0
    }
  },
  "execution": {
    "mode": "replay",
    "target_source": "reference-corpus",
    "scanners": {
      "dast": {
        "status": "completed"
      },
      "sca": {
        "status": "completed"
      },
      "secrets": {
        "status": "completed"
      }
    }
  },
  "audit_id": "85b67b51-29d2-5edb-b66e-76acb879b8f0"
}
